{
 "bnapCases": 1,
 "area": "credential",
 "title": "The Credential, its envelope and the identifiers",
 "schema": "schema/credential.schema.json",
 "generator": "conformance/gen_cases.py",
 "source": "spec/socket-draft-00.md (doc rev 39), spec/ERRATA.md, spec/DECISIONS.md, registry/generated/registry.json, reference/python/bnap_ref.py",
 "numberOfTests": 65,
 "header": [
  "Credentials are TLV streams (draft-00 section 5). Context, Digest and ReplayKey follow",
  "5.2 and 6.1, with attestations in the credential's sorted order. Scheme bodies are",
  "placeholders, as in vectors.json. The witness key of the class S cases is",
  "SHA-256(\"bnap test note key\"): it signs the Digest, as the bnap:notes registry entry says.",
  "DpopCanonicalBody uses the suite's DPoP adapter profile bnap-conf-dpop-1 (conformance/bnap_conf/dpop.py)",
  "with the P-256 key SHA-256(\"bnap conformance dpop key\") and RFC 6979 nonces, normalized to low-S."
 ],
 "notes": {
  "Valid": {
   "bugType": "BASIC",
   "description": "A well-formed input every implementation must accept."
  },
  "Structure": {
   "bugType": "MALFORMED",
   "description": "A 5.1 rule is broken."
  },
  "Version": {
   "bugType": "VERSION",
   "description": "An unsupported socket version."
  },
  "Size": {
   "bugType": "TOO_LARGE",
   "description": "Over the size limit; the HTTP cap is DECISIONS row 30."
  },
  "UnknownOdd": {
   "bugType": "BASIC",
   "description": "An unknown odd record outside ext, which MUST NOT affect processing."
  },
  "EmptyForms": {
   "bugType": "BASIC",
   "description": "The \"or empty\" forms of section 2: absent and empty hash the same."
  },
  "Binding": {
   "bugType": "BASIC",
   "description": "The binding is in the Digest, not in the Context or the ReplayKey."
  },
  "PathAttack": {
   "bugType": "BAD_CREDENTIAL",
   "description": "A path attacker changed the credential; the class S witness over the Digest no longer verifies."
  },
  "SharedRail": {
   "bugType": "BASIC",
   "description": "One payment named by two schemes has one RailId."
  },
  "TwoValue": {
   "bugType": "MALFORMED",
   "description": "More than one value credential in one request."
  },
  "Ambiguous": {
   "bugType": "EDGE",
   "description": "draft-00 does not settle this; either answer is acceptable."
  },
  "NonCanonical": {
   "bugType": "MALFORMED",
   "description": "A DPoP body that is not the profile's one encoding: it holds bytes the scheme does not verify (5.1)."
  },
  "Malleable": {
   "bugType": "BAD_CREDENTIAL",
   "description": "A second encoding of a valid proof: plain ECDSA also accepts (r, n - s), so a party on the path could make it. The profile requires s <= n/2, so it does not verify (5.1, 12)."
  }
 },
 "testGroups": [
  {
   "type": "CredentialParse",
   "section": "5.1",
   "description": "Parse a credential and apply the 5.1 rules. With carrier http, the cap is 9,216 bytes (DECISIONS row 30); otherwise max_credential.",
   "tests": [
    {
     "tcId": 1,
     "comment": "draft-00 section 14 credential, 581 bytes",
     "flags": [
      "Valid"
     ],
     "sections": [
      "5.1"
     ],
     "inputs": {
      "credential": "00010102fd01310001010220862d641e67813f6e78b20a81aa929519e66a978e69e8a4d3e27280990697f3a0040008000a046acb2d4c0c2468747470733a2f2f6170692e6578616d706c652f2e77656c6c2d6b6e6f776e2f626e61700e20b28dad5f717c5144bdb0aa6db94bb6c79afa9b8bd9bc84825a2c1baafe64add91010000102030405060708090a0b0c0d0e0f121a19000a626e61703a6e6f7465730202083404037361740a0201f4141e1d0014687474707369673a7765622d626f742d61757468020102040207d0f040fa3a850dff40a2fe54f5662580783b3e4d63fbc3a99ea4832465d60427d849cf31d35c759da7958591b12c2fc51a4aee30288636999720a9813b714d996d2d3af220a29714a6310d1153b6477c0a06e297d0d18f614a52d2bf31926900693620fc13feb2d05e01020a0a048e000a626e61703a6e6f746573023e0020a75dc69b09c6b0022047e018721f76024cac83bf199b59a6f1993895cc8f3476021a70726f6f66732b6f75747075747320706c616365686f6c646572044092bbc9b11d614345397555b025d1f710b138386a45d6716aed191cf0a85b437928f222649846c0ba863d245b7599cb356b285147c8ac0e980e979aa56a9ae0340659580014687474707369673a7765622d626f742d617574680240736967313d3a2e2e2e706c616365686f6c6465722077656220626f742061757468207369676e6174757265206f7665722074686520436f6e746578742e2e2e3a0820dfe7944e1268f1b4b7418282dcf52a6f0f8a5092e31e0bb30bc4d4628dda2218",
      "max_credential": 16384,
      "carrier": "none"
     },
     "result": "valid",
     "expected": {
      "pay_scheme": "bnap:notes",
      "attest_schemes": [
       "httpsig:web-bot-auth"
      ],
      "binding": "dfe7944e1268f1b4b7418282dcf52a6f0f8a5092e31e0bb30bc4d4628dda2218",
      "offer_form": "inline",
      "ignored": []
     }
    },
    {
     "tcId": 2,
     "comment": "the same credential naming its offer by OfferID",
     "flags": [
      "Valid"
     ],
     "sections": [
      "5.1"
     ],
     "inputs": {
      "credential": "000101048e000a626e61703a6e6f746573023e0020a75dc69b09c6b0022047e018721f76024cac83bf199b59a6f1993895cc8f3476021a70726f6f66732b6f75747075747320706c616365686f6c646572044092bbc9b11d614345397555b025d1f710b138386a45d6716aed191cf0a85b437928f222649846c0ba863d245b7599cb356b285147c8ac0e980e979aa56a9ae0340659580014687474707369673a7765622d626f742d617574680240736967313d3a2e2e2e706c616365686f6c6465722077656220626f742061757468207369676e6174757265206f7665722074686520436f6e746578742e2e2e3a0820dfe7944e1268f1b4b7418282dcf52a6f0f8a5092e31e0bb30bc4d4628dda22180c205c8640261f6f1de3206a2e9cd1c2599a2e9256547242061c95f9d2e06cf6696d",
      "max_credential": 16384,
      "carrier": "none"
     },
     "result": "valid",
     "expected": {
      "pay_scheme": "bnap:notes",
      "attest_schemes": [
       "httpsig:web-bot-auth"
      ],
      "binding": "dfe7944e1268f1b4b7418282dcf52a6f0f8a5092e31e0bb30bc4d4628dda2218",
      "offer_form": "reference",
      "ignored": []
     }
    },
    {
     "tcId": 3,
     "comment": "both offer and offer_id",
     "flags": [
      "Structure"
     ],
     "sections": [
      "5.1"
     ],
     "inputs": {
      "credential": "00010102fd01310001010220862d641e67813f6e78b20a81aa929519e66a978e69e8a4d3e27280990697f3a0040008000a046acb2d4c0c2468747470733a2f2f6170692e6578616d706c652f2e77656c6c2d6b6e6f776e2f626e61700e20b28dad5f717c5144bdb0aa6db94bb6c79afa9b8bd9bc84825a2c1baafe64add91010000102030405060708090a0b0c0d0e0f121a19000a626e61703a6e6f7465730202083404037361740a0201f4141e1d0014687474707369673a7765622d626f742d61757468020102040207d0f040fa3a850dff40a2fe54f5662580783b3e4d63fbc3a99ea4832465d60427d849cf31d35c759da7958591b12c2fc51a4aee30288636999720a9813b714d996d2d3af220a29714a6310d1153b6477c0a06e297d0d18f614a52d2bf31926900693620fc13feb2d05e01020a0a048e000a626e61703a6e6f746573023e0020a75dc69b09c6b0022047e018721f76024cac83bf199b59a6f1993895cc8f3476021a70726f6f66732b6f75747075747320706c616365686f6c646572044092bbc9b11d614345397555b025d1f710b138386a45d6716aed191cf0a85b437928f222649846c0ba863d245b7599cb356b285147c8ac0e980e979aa56a9ae0340659580014687474707369673a7765622d626f742d617574680240736967313d3a2e2e2e706c616365686f6c6465722077656220626f742061757468207369676e6174757265206f7665722074686520436f6e746578742e2e2e3a0820dfe7944e1268f1b4b7418282dcf52a6f0f8a5092e31e0bb30bc4d4628dda22180c205c8640261f6f1de3206a2e9cd1c2599a2e9256547242061c95f9d2e06cf6696d",
      "max_credential": 16384,
      "carrier": "none"
     },
     "result": "invalid",
     "error": "MALFORMED",
     "errorCode": 2
    },
    {
     "tcId": 4,
     "comment": "neither offer nor offer_id",
     "flags": [
      "Structure"
     ],
     "sections": [
      "5.1"
     ],
     "inputs": {
      "credential": "000101048e000a626e61703a6e6f746573023e0020a75dc69b09c6b0022047e018721f76024cac83bf199b59a6f1993895cc8f3476021a70726f6f66732b6f75747075747320706c616365686f6c646572044092bbc9b11d614345397555b025d1f710b138386a45d6716aed191cf0a85b437928f222649846c0ba863d245b7599cb356b285147c8ac0e980e979aa56a9ae0340659580014687474707369673a7765622d626f742d617574680240736967313d3a2e2e2e706c616365686f6c6465722077656220626f742061757468207369676e6174757265206f7665722074686520436f6e746578742e2e2e3a0820dfe7944e1268f1b4b7418282dcf52a6f0f8a5092e31e0bb30bc4d4628dda2218",
      "max_credential": 16384,
      "carrier": "none"
     },
     "result": "invalid",
     "error": "MALFORMED",
     "errorCode": 2
    },
    {
     "tcId": 5,
     "comment": "neither pay nor attest",
     "flags": [
      "Structure"
     ],
     "sections": [
      "5.1"
     ],
     "inputs": {
      "credential": "00010102fd01310001010220862d641e67813f6e78b20a81aa929519e66a978e69e8a4d3e27280990697f3a0040008000a046acb2d4c0c2468747470733a2f2f6170692e6578616d706c652f2e77656c6c2d6b6e6f776e2f626e61700e20b28dad5f717c5144bdb0aa6db94bb6c79afa9b8bd9bc84825a2c1baafe64add91010000102030405060708090a0b0c0d0e0f121a19000a626e61703a6e6f7465730202083404037361740a0201f4141e1d0014687474707369673a7765622d626f742d61757468020102040207d0f040fa3a850dff40a2fe54f5662580783b3e4d63fbc3a99ea4832465d60427d849cf31d35c759da7958591b12c2fc51a4aee30288636999720a9813b714d996d2d3af220a29714a6310d1153b6477c0a06e297d0d18f614a52d2bf31926900693620fc13feb2d05e01020a0a",
      "max_credential": 16384,
      "carrier": "none"
     },
     "result": "invalid",
     "error": "MALFORMED",
     "errorCode": 2
    },
    {
     "tcId": 6,
     "comment": "attest list out of order",
     "flags": [
      "Structure"
     ],
     "sections": [
      "5.1"
     ],
     "inputs": {